0: Flying Club Pilot Supplies
1: Revised | 1: 10/17/2008
2: 38047
3: Click on underscored items
4: To see a picture
5: Recommended for Student Pilots
7: GPS Reference Sheet | 7: 3 | A7: 0.06 | B7: =B7*(1+C7) -> 3.18
8: GPS CDROM Simulator | 8: 8 | A8: 0.06 | B8: =B8*(1+C8) -> 8.48
9: GPS Complete Manual | 9: 8 | A9: 0.06 | B9: =B9*(1+C9) -> 8.48
10: Cinn Sectional | 10: 8 | A10: 6% | B10: =B10*(1+C10) -> 8.48
11: St Louis Sectional | 11: 8 | A11: 6% | B11: =B10*(1+C10) -> 8.48
12: Cinn Terminal Area Chart | 12: 4.25 | A12: 0.06 | B12: =B12*(1+C12) -> 4.5049999999999999
13: SE Airport Facility Directory | 13: 4.2 | A13: 0.06 | B13: =B13*(1+C13) -> 4.4520000000000008
14: L21/22 Enroute Chart | 14: 4.1 | A14: 0.06 | B14: =B14*(1+C14) -> 4.3460000000000001
15: SE-1 Approach Plates | 15: 4.25 | A15: 0.06 | B15: =B15*(1+C15) -> 4.5049999999999999
16: CG-20 WAC Chart | 16: 8 | A16: 0.06 | B16: =B16*(1+C16) -> 8.48
17: 150 POH | 17: 27 | A17: 0.06 | B17: =B19*(1+C19) -> 31.8
18: 172 POH | 18: 27 | A18: 0.06 | B18: =B19*(1+C19) -> 31.8
19: Archer POH | 19: 30 | A19: 0.06 | B19: =B19*(1+C19) -> 31.8
20: Arrow II POH | 20: $30.00 | A20: 0.06 | B20: =B19*(1+C19) -> 31.8
21: Cessna 182RG POH | 21: $40.00 | A21: 0.06 | B21: =B19*(1+C19) -> 31.8
22: Seneca I POH | 22: 35 | A22: 0.06 | B22: =B20*(1+C20) -> 37.1
23: Sure Check Compact Checklist
24: 150 | 24: 14.95 | A24: 0.06 | B24: =B22*(1+C22) -> 15.847
25: 172 | 25: 14.95 | A25: 0.06 | B25: =B23*(1+C23) -> 15.847
26: Archer | 26: 14.95 | A26: 0.06 | B26: =B24*(1+C24) -> 15.847
27: Chapps Pocket Checklist
28: 150 | 28: 13.25 | A28: 0.06 | B28: =B26*(1+C26) -> 14.045
29: 172 | 29: 13.25 | A29: 0.06 | B29: =B27*(1+C27) -> 14.045
30: Archer | 30: 13.25 | A30: 0.06 | B30: =B28*(1+C28) -> 14.045
31: Checkmate 6 x 9 Checklist
32: 150 | 32: 14.95 | A32: 0.06 | B32: =B30*(1+C30) -> 15.847
33: 172 | 33: 14.95 | A33: 0.06 | B33: =B31*(1+C31) -> 15.847
34: Archer | 34: 14.95 | A34: 0.06 | B34: =B32*(1+C32) -> 15.847
35: Checkmate Pocket Checklist
36: C150 | 36: 10 | A36: 0.06 | B36: =B34*(1+C34) -> 10.6
37: Volume II version  C150 | 37: $18.00 | A37: 0.06 | B37: =B36*(1+C36) -> 10.6
38: C172 | 38: 10 | A38: 0.06 | B38: =B35*(1+C35) -> 10.6
39: Volume II version  C172 | 39: $18.00 | A39: 0.06 | B39: =B36*(1+C36) -> 10.6
40: Archer | 40: 10 | A40: 0.06 | B40: =B36*(1+C36) -> 10.6
41: Volume II version  Archer | 41: $18.00 | A41: 0.06 | B41: =B36*(1+C36) -> 10.6
42: Arrow II | 42: $10.00 | A42: 0.06 | B42: =B36*(1+C36) -> 10.6
43: Volume II version  Arrow II | 43: $18.00 | A43: 0.06 | B43: =B36*(1+C36) -> 10.6
44: Private Pilot Kit | 44: 119.95 | A44: 0.06 | B44: =B37*(1+C37) -> 127.14700000000001
45: Guide to the BFR | 45: 12.95 | A45: 0.06 | B45: =B38*(1+C38) -> 13.727
46: FAR/AIM 2009 | 46: 15.95 | A46: 0.06 | B46: =B39*(1+C39) -> 16.907 | E46: in kit
47: Pilot Handbook of Aeronautical Knowledge | 47: 19.95 | A47: 0.06 | B47: =B40*(1+C40) -> 21.147000000000002
48: Instrument Flying Handbook | 48: 19.95 | A48: 0.06 | B48: =B41*(1+C41) -> 21.147000000000002
49: Aviation Wx / Aviation Wx Services | 49: 24.95 | A49: 0.06 | B49: =B42*(1+C42) -> 26.446999999999999
50: Private CD ROM Written Test Guide | 50: 49.95 | A50: 0.06 | B50: =B43*(1+C43) -> 52.947000000000003 | E50: in kit
51: Instrument CD ROM Written Test Guide | 51: 59.95 | A51: 0.06 | B51: =B44*(1+C44) -> 63.547000000000004
52: Commercial CD ROM Written Test Guide | 52: 59.95 | A52: 0.06 | B52: =B45*(1+C45) -> 63.547000000000004
53: Private Written Test Guide | 53: 15.95 | A53: 0.06 | B53: =B46*(1+C46) -> 16.907 | E53: in kit
54: Instrument Written Test Guide | 54: 18.95 | A54: 0.06 | B54: =B50*(1+C50) -> 20.087
55: Commercial Written Test Guide | 55: 14.95 | A55: 0.06 | B55: =B48*(1+C48) -> 15.847
56: Private Test Prep and Flight Maneuvers | 56: 19.95 | A56: 0.06 | B56: =B49*(1+C49) -> 21.147000000000002 | E56: in kit
57: Instrument Test Prep and Flight Maneuvers | 57: 18.95 | A57: 0.06 | B57: =B50*(1+C50) -> 20.087
58: Commercial Test Prep and Flight Maneuvers | 58: 14.95 | A58: 0.06 | B58: =B51*(1+C51) -> 15.847
59: Private Oral Test Prep - Q&A's | 59: 12.95 | A59: 0.06 | B59: =B52*(1+C52) -> 13.727
60: Instrument Oral Test Prep - Q&A's | 60: 12.95 | A60: 0.06 | B60: =B53*(1+C53) -> 13.727
61: Commercial Oral Test Prep - Q&A's | 61: 12.95 | A61: 0.06 | B61: =B54*(1+C54) -> 13.727
62: Multi-engine Oral Test Prep - Q&A's | 62: 12.95 | A62: 0.06 | B62: =B55*(1+C55) -> 13.727
63: Multi-Engine Guide and PTS | 63: 19.95 | A63: 0.06 | B63: =B56*(1+C56) -> 21.147000000000002
64: Flight Bag | 64: 29.95 | A64: 0.06 | B64: =B57*(1+C57) -> 31.747 | E64: in kit
65: Sheet Protectors (10) for NOS charts | 65: 4.95 | A65: 0.06 | B65: =B58*(1+C58) -> 5.2470000000000008
66: NOS/NACO Chart Binder | 66: $12.95 | A66: 0.06 | B66: =B59*(1+C59) -> 13.727
67: Holding Pattern Visualizer | 67: 12.95 | A67: 0.06 | B67: =B59*(1+C59) -> 13.727
68: Partial Panel Instrument Cover-ups | 68: 4.95 | A68: 0.06 | B68: =B60*(1+C60) -> 5.2470000000000008
69: Digital Timer/Stopwatch | 69: $14.95 | A69: 0.06 | B69: =B67*(1+C67) -> 13.727
70: Pathfinder Electronic E6B | 70: 79.95 | A70: 0.06 | B70: =B61*(1+C61) -> 84.747000000000014
71: Paper E6B | 71: 9.95 | A71: 0.06 | B71: =B62*(1+C62) -> 10.547000000000001 | E71: in kit
72: Aluminum E6B | 72: 26.95 | A72: 0.06 | B72: =B63*(1+C63) -> 28.567
73: Pilot Logbook | 73: 9.95 | A73: 0.06 | B73: =B64*(1+C64) -> 10.547000000000001 | E73: in kit
74: Ultimate Fixed Plotter | 74: 7.95 | A74: 0.06 | B74: =B65*(1+C65) -> 8.4270000000000014 | E74: in kit
75: Fuel Sampler | 75: 4.95 | A75: 0.06 | B75: =B66*(1+C66) -> 5.2470000000000008
76: VFR Knee Board | 76: 12.95 | A76: 0.06 | B76: =B67*(1+C67) -> 13.727
77: VFR Tri-fold Kneeboard | 77: 29.95 | A77: 0.06 | B77: =B68*(1+C68) -> 31.747
78: Flight Planning Sheets | 78: 4.95 | A78: 0.06 | B78: =B69*(1+C69) -> 5.2470000000000008
79: Foggles IFR Glasses | 79: 23.5 | A79: 0.06 | B79: =B70*(1+C70) -> 24.91
80: Jiffyhood IFR Hood | 80: 12.95 | A80: 0.06 | B80: =B71*(1+C71) -> 13.727
81: VFR Communications CDROM | 81: 8 | A81: 0.06 | B81: =B72*(1+C72) -> 8.48
82: IFR Communications CDROM | 82: 8 | A82: 0.06 | B82: =B73*(1+C73) -> 8.48
83: David Clark 13.4 ounce Headset | 83: 279 | A83: 0.06 | B83: =B74*(1+C74) -> 295.74
84: Air Classics 2nd Headset | 84: 149.95 | A84: 0.06 | B84: =B75*(1+C75) -> 158.947
85: Flightcom 4DLX Headset | 85: 139 | A85: 0.06 | B85: =B76*(1+C76) -> 147.34
86: Flightcom 5DX Headset (incl carrying bag) | 86: 189 | A86: 0.06 | B86: =B77*(1+C77) -> 200.34